<?xml version="1.0" encoding="UTF-8"?>
<!-- 编辑使用 XMLSpy v2006 U (http://www.altova.com) 由 any (any) -->
<!-- 编辑使用 XMLSpy v2006 U (http://www.altova.com) 由 any (any) -->
<!-- 编辑使用 XMLSpy v2006 U (http://www.altova.com) 由 any (any) -->
<!-- 编辑使用 XMLSpy v2006 U (http://www.altova.com) 由 any (any) -->
<Tasks xmlns:xsi="http://www.w3.org/2001/XMLSchema-instance" xsi:noNamespaceSchemaLocation="C:\mydoc\myprojects\ereminder\Reminder\modules\shopping\src\main\resources\Task_2_0.xsd" storeId="childrenslibrary" rootVolume="999999" productType="book">
	<CatTask isLeaf="true">
		<baseBrowseTask taskName="cat-0" isStart="true" enableJS="false">
			<startUrl value="http://www.childrenslibrary.org/icdl/TextSearch?page=1"/>
			<idUrlMapping>
				<Token name="prefix" value="http://www." type="string"/>
				<Token name="id" value="childrenslibrary" type="string"/>
				<Token name="mid" value=".org/icdl/TextSearch?page=" type="string"/>
				<Token name="pageNum" value="[0-9]+" type="regexp"/>
			</idUrlMapping>
			<itemName value="childrenslibrary"/>
		</baseBrowseTask>
		<subItemList nextPage="//img[@id=&apos;reader_arrow_right_bottom&apos;]">
			<itemList value="//body/table[1]/tbody/tr/td"/>
			<itemFullUrl value="a[1]" toType="url"/>
		</subItemList>
		<itemPerPage value="//select[@name=&apos;pgct&apos;]/option[@selected]"/>
		<totalItemNum value="//body/div[3]/div[2]/span[1]">
			<strPreprocess trimPost="books"/>
		</totalItemNum>
	</CatTask>
	<PrdTask>
		<baseBrowseTask taskName="prd" enableJS="false">
			<userAttribute name="bookpageurls">
				<value value="//a[@id='next_cover']/img" fromType="xpath" toType="externalList"/>
			</userAttribute>
			<idUrlMapping>
				<Token name="prefix" value="http://www.childrenslibrary.org/icdl/BookPreview?bookid=" type="string"/>
				<Token name="id" value="[_a-zA-Z0-9]+" type="regexp"/>
				<Token name="suffix" value="&amp;.*" type="regexp"/>
			</idUrlMapping>
			<itemName value="//body/table[1]/tbody/tr/td/table[1]/tbody/tr/td/span[1]"/>
		</baseBrowseTask>
		<firstPageClickStream>
			<link>
				<nextpage>
					<successNextPage name="indexPage">
						<value value="//a[@id=&apos;readbook_link&apos;]" toType="page"/>
					</successNextPage>
				</nextpage>
			</link>
			<link>
				<nextpage>
					<successNextPage name="firstPage">
						<value value="//div[@id=&apos;bookpages&apos;]/a[1]" toType="page" basePage="indexPage"/>
					</successNextPage>
				</nextpage>
			</link>
		</firstPageClickStream>
		<totalPage value="count(//div[@id=&apos;bookpages&apos;]/a|//div[@id=&apos;bookpages&apos;]/span/a)" toType="int" basePage="indexPage"/>
		<nextPage value="//a[@id=&apos;next_bottom&apos;]"/>
	</PrdTask>
</Tasks>
