<?xml version="1.0" encoding="UTF-8"?>
<!-- 编辑使用 XMLSpy v2006 U (http://www.altova.com) 由 any (any) -->
<!-- 编辑使用 XMLSpy v2006 U (http://www.altova.com) 由 any (any) -->
<!-- 编辑使用 XMLSpy v2006 U (http://www.altova.com) 由 any (any) -->
<Tasks xmlns:xsi="http://www.w3.org/2001/XMLSchema-instance" xsi:noNamespaceSchemaLocation="C:\mydoc\myprojects\ereminder\Reminder\modules\shopping\src\main\resources\Task_2_0.xsd" rootVolume="999990" storeId="sina-stock-fr-quarter-CashFlow" productType="default">
	<PrdTask>
		<baseBrowseTask enableJS="true" taskName="cashflow">
			<param name="stockid"/>
			<param name="year"/>
			<param name="quarter"/>
			<param name="startDate" type="string"/>
			<param name="endDate" type="string"/>
			<startUrl value="http://money.finance.sina.com.cn/corp/go.php/vFD_CashFlow/stockid/[stockid]/ctrl/[year]/displaytype/4.phtml"/>
			<userAttribute name="id">
				<value value="stockid + '_' + year + '_' + quarter" toType="string" fromType="expression"/>
			</userAttribute>
			<userAttribute name="quarterAvail">
				<value value="count(//table[@id='ProfitStatementNewTable0']/tbody/tr[1]/td)" toType="int" optional="true"/>
			</userAttribute>
			<userAttribute name="data">
				<value value="quarterAvail>quarter? &quot;//table[@id='ProfitStatementNewTable0']/tbody/tr[count(td)>1]/td[&quot; + (quarterAvail + 1 - quarter) + &quot;]&quot; : null" toType="list" fromType="expression" optional="true"/>
			</userAttribute>
			<userAttribute name="ColNum">
				<value value="1" toType="int"/>
			</userAttribute>
			<userAttribute name="HasHeader">
				<value value="false" toType="boolean"/>
			</userAttribute>
			<pageVerify operator="!=">
				<lhs value="//table[@id='ProfitStatementNewTable0']/tbody/tr/td">
				</lhs>
				<rhs value="null">
				</rhs>
			</pageVerify>
			<csvtransform transformClass="org.cld.etl.csv.SpreadColTableAsCSV" outputType="byJobSingle">
				<outputDir value="raw/[startDate]_[endDate]/sina-stock-fr-quarter-CashFlow/[year]_[quarter]"/>
			</csvtransform>
		</baseBrowseTask>
	</PrdTask>
</Tasks>
