<?xml version="1.0" encoding="UTF-8"?>
<!-- 编辑使用 XMLSpy v2006 U (http://www.altova.com) 由 any (any) -->
<!-- 编辑使用 XMLSpy v2006 U (http://www.altova.com) 由 any (any) -->
<!-- 编辑使用 XMLSpy v2006 U (http://www.altova.com) 由 any (any) -->
<!-- 编辑使用 XMLSpy v2006 U (http://www.altova.com) 由 any (any) -->
<Tasks xmlns:xsi="http://www.w3.org/2001/XMLSchema-instance" xsi:noNamespaceSchemaLocation="C:\mydoc\myprojects\reminder\maven.1411262641248\Reminder\modules\shopping\src\main\resources\Task_2_0.xsd" storeId="vyming" rootVolume="999996" maxThread="1">
	<CatTask isLeaf="false">
		<baseBrowseTask enableJS="false" startUrl="http://bbs.vyming.com/novel-list-0-0-0-0-0-0-0-1.html">
			<idUrlMapping>
				<Token name="prefix" value="http://bbs."/>
				<Token name="id" value="vyming"/>
				<Token name="suffix" value=".com/novel-list-0-0-0-0-0-0-0-1.html"/>
			</idUrlMapping>
		</baseBrowseTask>
		<subItemList isLeaf="true">
			<itemList value="//div[@id=&apos;nv&apos;]/ul/li/a"/>
			<name value="./text()"/>
		</subItemList>
		<totalPageNum value="1"/>
	</CatTask>
	<CatTask isLeaf="true">
		<baseBrowseTask enableJS="false" startUrl="http://bbs.vyming.com/novel-list-1-0-0-0-0-0-0-1.html">
			<idUrlMapping>
				<Token name="prefix" value="http://bbs.vyming.com/novel-list-" type="string"/>
				<Token name="id" value="[1-9]+" type="regexp"/>
				<Token name="mid" value="-0-0-0-0-0-0-" type="string"/>
				<Token name="pageNum" value="[0-9]+" type="regexp"/>
				<Token name="suffix" value=".html" type="string"/>
			</idUrlMapping>
		</baseBrowseTask>
		<subItemList itemFullUrl="./div[1]/a[1]" isLeaf="true" lastItem="./div[1]/a[last()]/text()">
			<itemList value="//*[@id=&quot;pdmodule&quot;]/div[4]/div/div[2]/div"/>
			<userAttribute name="author">
				<value value="./div[1]/a[2]/following::text()[1]">
					<strPreprocess trimPost="/&#33879;"/>
				</value>
			</userAttribute>
			<userAttribute name="utime">
				<value value="./div[1]/a[2]/following::text()[2]" toType="date" format="yyyy-MM-dd hh:mm">
					<strPreprocess trimPost="&#26356;&#26032;&#33267;&#65306;"/>
				</value>
			</userAttribute>
			<name value="./div[1]/a[1]/@title"/>
		</subItemList>
		<totalPageNum value="//input[@id=&apos;pageindex1&apos;]/@value"/>
	</CatTask>
	<PrdTask imagePath="//*[@id=&quot;showcontent&quot;]">
		<baseBrowseTask enableJS="false" startUrl="http://bbs.vyming.com/novel-view-18301.html">
			<idUrlMapping>
				<Token name="prefix" value="http://bbs.vyming.com/novel-view-" type="string"/>
				<Token name="id" value="[0-9]+" type="regexp"/>
				<Token name="suffix" value=".html" type="string"/>
			</idUrlMapping>
		</baseBrowseTask>
		<firstPageClickStream>
			<link>
				<nextpage name="indexPage">
					<value value="//*[@id=&quot;info&quot;]/div[5]/a[2]">
						<sampleUrl>http://bbs.vyming.com/novel-chapter-18301.html</sampleUrl>
						<sampleUrl>http://bbs.vyming.com/novel-read-18301-3912991.html</sampleUrl>
					</value>
				</nextpage>
			</link>
		</firstPageClickStream>
		<directPages value="//div[@class=&apos;contentlist&apos;]/ul/a" toType="list" basePage="indexPage"/>
	</PrdTask>
</Tasks>
