<?xml version="1.0" encoding="UTF-8"?>
<!-- 编辑使用 XMLSpy v2006 U (http://www.altova.com) 由 any (any) -->
<Tasks xmlns:xsi="http://www.w3.org/2001/XMLSchema-instance" xsi:noNamespaceSchemaLocation="C:\mydoc\myprojects\ereminder\Reminder\modules\shopping\src\main\resources\Task_2_0.xsd" rootVolume="999990" storeId="sina-stock-fr-history" productType="default">
	<!-- all financial reports -->
	<PrdTask>
		<baseBrowseTask enableJS="true" taskName="all-balancesheet">
			<param name="stockid"/>
			<startUrl value="http://money.finance.sina.com.cn/corp/go.php/vDOWN_BalanceSheet/displaytype/4/stockid/[stockid]/ctrl/all.phtml"/>
			<cachePage value="BalanceSheet/[stockid]"/>
			<idUrlMapping>
				<Token value="http://money.finance.sina.com.cn/corp/go.php/vDOWN_BalanceSheet/displaytype/4/stockid/" name="prefix" type="string"/>
				<Token value="[0-9]+" name="id" type="regexp"/>
				<Token value="/ctrl/all.phtml" name="suffix" type="string"/>
			</idUrlMapping>
		</baseBrowseTask>
	</PrdTask>
	<PrdTask>
		<baseBrowseTask enableJS="true" taskName="all-profitstatement">
			<param name="stockid"/>
			<startUrl value="http://money.finance.sina.com.cn/corp/go.php/vDOWN_ProfitStatement/displaytype/4/stockid/[stockid]/ctrl/all.phtml"/>
			<cachePage value="ProfitStatement/[stockid]"/>
			<idUrlMapping>
				<Token value="http://money.finance.sina.com.cn/corp/go.php/vDOWN_ProfitStatement/displaytype/4/stockid/" name="prefix" type="string"/>
				<Token value="[0-9]+" name="id" type="regexp"/>
				<Token value="/ctrl/all.phtml" name="suffix" type="string"/>
			</idUrlMapping>
		</baseBrowseTask>
	</PrdTask>
	<PrdTask>
		<baseBrowseTask enableJS="true" taskName="all-cashflow">
			<param name="stockid"/>
			<startUrl value="http://money.finance.sina.com.cn/corp/go.php/vDOWN_CashFlow/displaytype/4/stockid/[stockid]/ctrl/all.phtml"/>
			<cachePage value="CashFlow/[stockid]"/>
			<idUrlMapping>
				<Token value="http://money.finance.sina.com.cn/corp/go.php/vDOWN_CashFlow/displaytype/4/stockid/" name="prefix" type="string"/>
				<Token value="[0-9]+" name="id" type="regexp"/>
				<Token value="/ctrl/all.phtml" name="suffix" type="string"/>
			</idUrlMapping>
		</baseBrowseTask>
	</PrdTask>
</Tasks>
