<?xml version="1.0" encoding="UTF-8"?>
<!-- 编辑使用 XMLSpy v2006 U (http://www.altova.com) 由 any (any) -->
<!-- 编辑使用 XMLSpy v2006 U (http://www.altova.com) 由 any (any) -->
<!-- 编辑使用 XMLSpy v2006 U (http://www.altova.com) 由 any (any) -->
<!-- 编辑使用 XMLSpy v2006 U (http://www.altova.com) 由 any (any) -->
<Tasks xmlns:xsi="http://www.w3.org/2001/XMLSchema-instance" xsi:noNamespaceSchemaLocation="C:\mydoc\myprojects\ereminder\Reminder\modules\shopping\src\main\resources\Task_2_0.xsd" rootVolume="999990" storeId="nasdaq-quote-oneminute" productType="default">
	<PrdTask tryPattern="false">
		<baseBrowseTask enableJS="true" dsm="hdfs" taskName="quote-onemiute" mbMemoryNeeded="512">
			<param name="marketId"/>
			<param name="stockid"/>
			<param name="startDate"/>
			<param name="endDate"/>
			<startUrl value="http://www.nasdaq.com/symbol/[stockid]/interactive-chart"/>
			<userAttribute name="id">
				<value value="stockid" toType="string" fromType="expression"/>
			</userAttribute>
			<userAttribute name="file">
				<value frameId="4" value="//div[@id='gridContainer']/div[1]/span[1]" toDirectory="raw/[marketId]/[startDate]_[endDate]/quote-oneminute/[stockid]" toType="file"/>
			</userAttribute>
		</baseBrowseTask>
		<firstPageClickStream>
			<link>
				<nextpage>
					<successNextPage name="setExtend">
						<value frameId="4" value="//ul[@id='chart-display']/li[@stxtoggle='toggleExt()']"/>
					</successNextPage>
				</nextpage>
			</link>
			<link>
				<nextpage>
					<successNextPage name="setGranular">
						<value frameId="4" value="//ul[@id='periodicity']/li[text()='1 D']"/>
					</successNextPage>
				</nextpage>
			</link>
			<link>
				<nextpage>
					<successNextPage name="setRange">
						<value frameId="4" value="//div[@id='stxViewRange']/ul[1]/li[@id='range1m']"/>
					</successNextPage>
				</nextpage>
			</link>
			<link>
				<nextpage>
					<successNextPage name="loadTable">
						<value frameId="4" value="//div[@id='dataTableBtn']">
							<pageVerify operator="!=">
								<lhs value="//div[@id='gridContainer']/div[1]/div[2]"/>
								<rhs value="null"/>
							</pageVerify>
						</value>
					</successNextPage>
				</nextpage>
			</link>
		</firstPageClickStream>
	</PrdTask>
</Tasks>
