<?xml version="1.0" encoding="UTF-8"?>
<Tasks xmlns:xsi="http://www.w3.org/2001/XMLSchema-instance" xsi:noNamespaceSchemaLocation="C:\mydoc\myprojects\reminder\maven.1411262641248\Reminder\modules\shopping\src\main\resources\Task_2_0.xsd" rootVolume="999990" storeId="hkse-stock-basic" productType="default">
	<CatTask isLeaf="true" splitTaskType="item">
		<baseBrowseTask enableJS="false" startUrl="http://www.hkex.com.hk/chi/market/sec_tradinfo/stockcode/eisdeqty_c.htm">
			<idUrlMapping>
				<Token value="http://www.hkex.com.hk/chi/market/sec_tradinfo/stockcode/eisdeqty_c.htm" name="id" type="string"/>
			</idUrlMapping>
		</baseBrowseTask>
		<subItemList>
			<itemList value="//table[@class='table_grey_border']/tbody/tr[position()>1]"/>
			<prdTaskParamMapping paramName="symbal" value="code" scope="attribute"/>
			<userAttribute name="code">
				<value value="td[1]/text()"/>
			</userAttribute>
		</subItemList>
		<totalPageNum value="1"/>
	</CatTask>
	<PrdTask nextPage="//input[@id='ctl00_gvMain_ctl01_btnNext']">
		<baseBrowseTask startUrl="http://www.hkexnews.hk/listedco/listconews/advancedsearch/search_active_main_c.aspx" enableJS="true" taskName="hksePrd">
			<param name="symbal" type="string"/>
			<userAttribute name="id">
				<value value="symbal" fromScope="param"/>
			</userAttribute>
			<userAttribute name="files">
				<value value="//table[@id='ctl00_gvMain']/tbody/tr/td[4]/a" toType="externalList" toEntryType="file" toDirectory="id"/>
			</userAttribute>
		</baseBrowseTask>
		<firstPageClickStream>
			<link>
				<input name="//input[@id='ctl00_txt_stock_code']">
					<value value="symbal" fromScope="param"/>
				</input>
				<nextpage name="resultpage">
					<value value="//form[@id='aspnetForm']/table[last()]/tbody/tr[last()]/td[last()]/label/a[1]"/>
				</nextpage>
			</link>
		</firstPageClickStream>
	</PrdTask>
</Tasks>
