<?xml version="1.0" encoding="UTF-8"?>
<!-- 编辑使用 XMLSpy v2006 U (http://www.altova.com) 由 any (any) -->
<!-- 编辑使用 XMLSpy v2006 U (http://www.altova.com) 由 any (any) -->
<!-- 编辑使用 XMLSpy v2006 U (http://www.altova.com) 由 any (any) -->
<!-- 编辑使用 XMLSpy v2006 U (http://www.altova.com) 由 any (any) -->
<!-- 编辑使用 XMLSpy v2006 U (http://www.altova.com) 由 any (any) -->
<!-- 编辑使用 XMLSpy v2006 U (http://www.altova.com) 由 any (any) -->
<!-- 编辑使用 XMLSpy v2006 U (http://www.altova.com) 由 any (any) -->
<!-- 编辑使用 XMLSpy v2006 U (http://www.altova.com) 由 any (any) -->
<Tasks xmlns:xsi="http://www.w3.org/2001/XMLSchema-instance" xsi:noNamespaceSchemaLocation="C:\mydoc\myprojects\ereminder\Reminder\modules\shopping\src\main\resources\Task_2_0.xsd" storeId="baoliny" rootVolume="999996" maxThread="2" productType="book">
	<CatTask isLeaf="false">
		<baseBrowseTask enableJS="false">
			<startUrl value="http://www.baoliny.com/"/>
			<idUrlMapping>
				<Token name="id" value="http://www.baoliny.com/"/>
			</idUrlMapping>
		</baseBrowseTask>
		<subItemList>
			<itemList value="//*[@id=&quot;wrapper&quot;]/div[4]/ul/li/a"/>
			<name value="./text()"/>
		</subItemList>
		<totalPageNum value="1"/>
	</CatTask>
	<CatTask isLeaf="true">
		<baseBrowseTask enableJS="false">
			<startUrl value="http://www.baoliny.com/sort_2_1.html"/>
			<idUrlMapping>
				<Token name="prefix" value="http://www.baoliny.com/sort_" type="string"/>
				<Token name="id" value="[0-9]+" type="regexp"/>
				<Token name="mid" value="_" type="string"/>
				<Token name="pageNum" value="[0-9]+" type="regexp"/>
				<Token name="suffix" value=".html" type="string"/>
			</idUrlMapping>
		</baseBrowseTask>
		<subItemList>
			<itemList value="//*[@id=&quot;newscontent&quot;]/div[1]/ul/li"/>
			<userAttribute name="author">
				<value value="./span[4]/text()"/>
			</userAttribute>
			<userAttribute name="utime">
				<value value="./span[5]/text()" toType="date" format="yy-MM-dd"/>
			</userAttribute>
			<name value="./span[2]/a/text()"/>
			<itemFullUrl value="./span[2]/a" toType="url"/>
		</subItemList>
		<totalPageNum value="//*[@id=&quot;pagelink&quot;]/a[last()]"/>
	</CatTask>
	<PrdTask>
		<baseBrowseTask enableJS="false">
			<startUrl value="http://www.baoliny.com/18/index.html"/>
			<userAttribute name="bookpageurls">
				<value value="//body/div/div[5]/div/div/div/ul/li/a | //body/div/div[5]/table/tbody/tr/td/a" toType="list"/>
			</userAttribute>
			<idUrlMapping>
				<Token name="prefix" value="http://www.baoliny.com/" type="string"/>
				<Token name="id" value="[0-9]+" type="regexp"/>
				<Token name="suffix" value="/index.html" type="string"/>
			</idUrlMapping>
		</baseBrowseTask>
	</PrdTask>
</Tasks>
