<?xml version="1.0" encoding="UTF-8"?>
<!-- 编辑使用 XMLSpy v2006 U (http://www.altova.com) 由 any (any) -->
<!-- 编辑使用 XMLSpy v2006 U (http://www.altova.com) 由 any (any) -->
<!-- 编辑使用 XMLSpy v2006 U (http://www.altova.com) 由 any (any) -->
<Tasks xmlns:xsi="http://www.w3.org/2001/XMLSchema-instance" xsi:noNamespaceSchemaLocation="C:\mydoc\myprojects\ereminder\Reminder\modules\shopping\src\main\resources\Task_2_0.xsd" rootVolume="999990" storeId="sina-stock-stock-structure" productType="default">
	<PrdTask>
		<baseBrowseTask enableJS="true" taskName="stock-structure" dsm="hdfs">
			<param name="marketId"/>
			<param name="stockid"/>
			<param name="startDate" type="string"/>
			<param name="endDate" type="string"/>
			<startUrl value="http://vip.stock.finance.sina.com.cn/corp/go.php/vCI_StockStructure/stockid/[stockid].phtml"/>
			<userAttribute name="id">
				<value value="stockid" toType="string" fromScope="param"/>
			</userAttribute>
			<userAttribute name="ColNum">
				<value value="count(//table[@id='StockStructureNewTable0']/tbody/tr[1]/td)" toType="int"/>
			</userAttribute>
			<userAttribute name="ColDateIdx">
				<value value="0" toType="int"/> <!-- use 变动日期,  公告日期  maybe null -->
			</userAttribute>
			<userAttribute name="RowNum">
				<value value="count(//table[@id='StockStructureNewTable0']/tbody/tr)" toType="int"/>
			</userAttribute>
			<userAttribute name="data">
				<value value="//table[contains(@id,'StockStructureNewTable')]/tbody/tr/td" toType="list"/>
			</userAttribute>
			<csvtransform transformClass="org.cld.etl.csv.SpreadColTableAsCSV" outputType="byJobSingle"><!-- 1 file -->
				<outputDir value="raw/[startDate]_[endDate]/sina-stock-stock-structure/"/>
			</csvtransform>
		</baseBrowseTask>
	</PrdTask>
</Tasks>
